<?xml version="1.0"?>
<xs:schema xmlns:xs="http://www.w3.org/2001/XMLSchema"
targetNamespace="http://www.w3schools.com"
xmlns="http://www.w3schools.com"
elementFormDefault="qualified">

<xs:include schemaLocation="global.xsd"/>

<xs:element name="behaviorsets" type="behaviorsetsType">
</xs:element>

<xs:complexType name="behaviorsetsType">
	<xs:sequence>
		<xs:element name="behaviorset" type="behaviorsetType" minOccurs="1" maxOccurs="unbounded">
		</xs:element>
	</xs:sequence>
</xs:complexType>

<xs:complexType name="behaviorsetType">
	<xs:sequence>
		<xs:element name="signals" type="signalsType" minOccurs="1" maxOccurs="1"/>
		<xs:element name="constraints" type="constraintsType" minOccurs="1" maxOccurs="1"/>	
	</xs:sequence>
	<xs:attribute name="name" type="xs:string" use="required"/>
</xs:complexType>

<xs:complexType name="constraintsType">
	<xs:sequence>
		<xs:element name="core" type="coreType" minOccurs="0" maxOccurs="1"/>
		<xs:element name="rules" type="rulesType" minOccurs="0" maxOccurs="1"/>
	</xs:sequence>
</xs:complexType>

<xs:complexType name="coreType">
	<xs:sequence>
		<xs:element name="item" type="itemType" minOccurs="0" maxOccurs="unbounded"/>
	</xs:sequence>
</xs:complexType>

<xs:complexType name="implicationType">
	<xs:sequence>
		<xs:element name="ifpresent" type="itemType" minOccurs="1" maxOccurs="1"/>
		<xs:element name="thenpresent" type="itemType" minOccurs="0" maxOccurs="unbounded"/>
		<xs:element name="thennotpresent" type="itemType" minOccurs="0" maxOccurs="unbounded"/>
	</xs:sequence>
</xs:complexType>

<xs:complexType name="rulesType">
	<xs:sequence>
		<xs:element name="implication" type="implicationType" minOccurs="0" maxOccurs="unbounded"/>
	</xs:sequence>
</xs:complexType>

<xs:complexType name="signalsType">
	<xs:sequence>
		<xs:element name="signal" type="signalType" minOccurs="1" maxOccurs="unbounded"/>
	</xs:sequence>
</xs:complexType>

<xs:complexType name="itemType">
	<xs:attribute name="id" type="xs:integer" use="required"/>
</xs:complexType>

<xs:complexType name="signalType">
	<xs:sequence>
		<xs:element name="alternative" type="alternativeShapeType" minOccurs="0" maxOccurs="unbounded"/>
	</xs:sequence>
	<xs:attribute name="id" type="xs:integer" use="required"/>
	<xs:attribute name="name" type="xs:string"/>
	<xs:attribute name="modality" type="parametersetNameType" use="required"/>
</xs:complexType>

<xs:complexType name="alternativeShapeType">
	<xs:attribute name="name" type="xs:string" use="required"/>
	<xs:attribute name="probability" type="xs:decimal" use="required"/>
</xs:complexType>



</xs:schema>